{
  "structured": [
    { "region": "AMER", "active_accounts": 412, "total_arr": 18250000, "currency": "USD" },
    { "region": "EMEA", "active_accounts": 287, "total_arr": 9930000, "currency": "USD" },
    { "region": "APAC", "active_accounts": 138, "total_arr": 4110000, "currency": "USD" }
  ],
  "structured_schema_ref": "salesforce-crm",
  "answer": "AMER leads on ARR at $18.25M across 412 active accounts; full per-region breakdown is in the structured payload.",
  "answer_id": "ans-9f2e30",
  "citations": [
    {
      "source_system": "salesforce",
      "domain_id": "salesforce-crm",
      "entity_type": "Account",
      "snippet": "GROUP BY region: SUM(arr), COUNT(account_id) WHERE is_active = true."
    },
    {
      "source_system": "sales-data-warehouse",
      "domain_id": "salesforce-crm",
      "entity_type": "Account",
      "snippet": "Region rollup reconciled against warehouse account dimension."
    }
  ],
  "timestamp": "2026-06-18T14:03:48Z",
  "is_draft": false
}
