{
  "structured": [
    { "category": "electronics", "total_revenue": 4820150, "total_units": 18204, "sale_count": 9912, "currency": "USD" },
    { "category": "apparel", "total_revenue": 2113400, "total_units": 41020, "sale_count": 15330, "currency": "USD" },
    { "category": "home", "total_revenue": 1564900, "total_units": 12876, "sale_count": 7044, "currency": "USD" },
    { "category": "outdoor", "total_revenue": 988200, "total_units": 6310, "sale_count": 3120, "currency": "USD" },
    { "category": "grocery", "total_revenue": 742650, "total_units": 88450, "sale_count": 22087, "currency": "USD" }
  ],
  "structured_schema_ref": "analytics-warehouse",
  "answer": "Electronics led last quarter with $4.82M in revenue across 9,912 sales; the full per-category revenue, units, and sale-count breakdown is in the structured payload.",
  "answer_id": "ans-sql-6b30",
  "citations": [
    {
      "source_system": "warehouse-sql",
      "domain_id": "analytics-warehouse",
      "entity_type": "FactSales",
      "snippet": "SQL: SELECT p.category, SUM(f.revenue) AS total_revenue, SUM(f.units) AS total_units, COUNT(f.sale_id) AS sale_count FROM fact_sales f JOIN dim_product p ON f.product_id = p.product_id JOIN dim_date d ON f.date_id = d.date_id WHERE d.quarter = $1 AND d.year = $2 GROUP BY p.category ORDER BY total_revenue DESC;  -- params: ['Q1', 2026]",
      "confidence": 0.97
    }
  ],
  "routing_decision": {
    "algorithm": "semantic-match",
    "rationale": "The question is a revenue/units/volume rollup over sales grouped by product category and filtered to last quarter. The analytics-warehouse domain owns FactSales over the warehouse-sql backend and joins dim_product for category and dim_date for the quarter filter. SQL computes SUM(revenue), SUM(units), and COUNT(sale_id) deterministically via aggregate functions and GROUP BY, so it was queried directly. No other domain owns warehouse sales facts, so routing stayed single-domain.",
    "alternative_routings": [
      {
        "domains": ["analytics-warehouse"],
        "score": 0.97,
        "reason": "Single-domain routing: warehouse-sql resolves the category group-by, the quarter filter via dim_date, and the sum/sum/count aggregations in one parameterized SELECT ... GROUP BY."
      }
    ],
    "reused_prior_routing": false
  },
  "timestamp": "2026-06-23T11:21:42Z"
}
